[
 {
  "id": "A1909-7:1",
  "act_id": "A1909-7",
  "section_number": "Section 1.",
  "slug": "1",
  "structural_unit": "section",
  "heading": "Short title and extent.",
  "full_text": "(1) This Act may be called the Anand Marriage Act, 1909; and.\n(2) Its extends to the whole of India 2***.",
  "chapter_id": null,
  "chapter_name": null,
  "language": "en"
 },
 {
  "id": "A1909-7:2",
  "act_id": "A1909-7",
  "section_number": "Section 2.",
  "slug": "2",
  "structural_unit": "section",
  "heading": "Validity of Anand marriages.",
  "full_text": "All marriages which may be or may have been duly solemnized according to the Sikh marriage ceremony called Anand 3[(commonly known as Anand Karaj)] shall be, and shall be deemed to have been with effect from the date Of the solemnization or each respectively, good and valid in law.",
  "chapter_id": null,
  "chapter_name": null,
  "language": "en"
 },
 {
  "id": "A1909-7:3",
  "act_id": "A1909-7",
  "section_number": "Section 3.",
  "slug": "3",
  "structural_unit": "section",
  "heading": "Exemption of certain marraiges from Act.",
  "full_text": "Nothing in this Act shall apply to—\n(a) any marriage between persons not professing the Sikh religion, or\n(b) any marriage which has been judically declared to be null and void.",
  "chapter_id": null,
  "chapter_name": null,
  "language": "en"
 },
 {
  "id": "A1909-7:4",
  "act_id": "A1909-7",
  "section_number": "Section 4.",
  "slug": "4",
  "structural_unit": "section",
  "heading": "Saving of marriages solemnized according to other ceremonies.",
  "full_text": "Nothing in this Act shall affect the validity of any marriage duly solemnized according to any other marriage ceremony customary among the Sikhs.",
  "chapter_id": null,
  "chapter_name": null,
  "language": "en"
 },
 {
  "id": "A1909-7:5",
  "act_id": "A1909-7",
  "section_number": "Section 5.",
  "slug": "5",
  "structural_unit": "section",
  "heading": "Non-validation of marriages within prohibited degrees.",
  "full_text": "Nothing in this Act shall be deemed to validate any marriage between persons who are related to each other in any degree of consanguinity or effinity which would, according to the customary law of the Sikhs, render a marriage between them illegal.",
  "chapter_id": null,
  "chapter_name": null,
  "language": "en"
 },
 {
  "id": "A1909-7:6",
  "act_id": "A1909-7",
  "section_number": "Section 6.",
  "slug": "6",
  "structural_unit": "section",
  "heading": "Registration of marriages.",
  "full_text": "(1) For the purposes of facilitation of proof of marriage ceremony (commonly known as Anand Karaj) customary among the Sikhs, the State Government shall, without prejudice to anything contained in the Hindu Marriage Act, 1955 (25 of 1955) or any other law for the time being in force, make rules providing that the parties to any such marriage [whether solemnized before or after the commencement of the Anand Marriage (Amendment) Act, 2012], may have the particulars relating to their marriage entered, in such manner and subject to such conditions as may be provided in the said rules, in a Marriage Register kept by such officer of the State Government or of a local authority authorised by the State Government, by notification in the Official Gazette, in this behalf.\n(2) The Marriage Register shall, at all reasonable times, be open for inspection, and shall be admissible as evidence of the statements contained therein and certified extracts therefrom shall, on an application, be given by the Registrar to the parties to the marriage on payment of such fees as may be provided in the rules.\n(3) Notwithstanding anything contained in this section, the validity of any Anand Marriage solemnized shall in no way be affected by the omission to make an entry in the Marriage Register.\n(4) Every rule made by the State Government under this section shall be laid before the State Legislature, as soon as may be, after they are made.\n(5) The parties to the marriage, whose marriage has been registered under this Act, shall not be required to get their marriage registered under any other law for the time being in force (including State Act).]",
  "chapter_id": null,
  "chapter_name": null,
  "language": "en"
 },
 {
  "id": "A1860-45:1",
  "act_id": "A1860-45",
  "section_number": "Section 1.",
  "slug": "1",
  "structural_unit": "section",
  "heading": "Title and extent of operation of the Code.",
  "full_text": "This Act shall be called the Indian Penal Code, and shall 3[extend to the whole of India 4***].",
  "chapter_id": "CHAPTER I",
  "chapter_name": "INTRODUCTION",
  "language": "en"
 },
 {
  "id": "A1860-45:2",
  "act_id": "A1860-45",
  "section_number": "Section 2.",
  "slug": "2",
  "structural_unit": "section",
  "heading": "Punishment of offences committed within India.",
  "full_text": "Every person shall be liable to punishment under this Code and not otherwise for every act or omission contrary to the provisions thereof, of which he shall be guilty within 5[India] 6***.",
  "chapter_id": "CHAPTER I",
  "chapter_name": "INTRODUCTION",
  "language": "en"
 },
 {
  "id": "A1860-45:3",
  "act_id": "A1860-45",
  "section_number": "Section 3.",
  "slug": "3",
  "structural_unit": "section",
  "heading": "Punishment of offences committed beyond, but which by law may be tried within, India.",
  "full_text": "Any person liable, by any 7[Indian law], to be tried for an offence committed beyond 8[India] shall be dealt with according to the provisions of this Code for any act committed beyond 8[India] in the same manner as if such act had been committed within 5[India].",
  "chapter_id": "CHAPTER I",
  "chapter_name": "INTRODUCTION",
  "language": "en"
 },
 {
  "id": "A1860-45:4",
  "act_id": "A1860-45",
  "section_number": "Section 4.",
  "slug": "4",
  "structural_unit": "section",
  "heading": "Extension of Code to extra-territorial offences.",
  "full_text": "The provisions of this Code apply also to any offence committed by—\n10[(1) any citizen of India in any place without and beyond India;\n(2) any person on any ship or aircraft registered in India wherever it may be.]\n11[(3) any person in any place without and beyond India committing offence targeting a computer resource located in India.]\n12[Explanation.—In this section—\n(a) the word “offence” includes every act committed outside India which, if committed in India,would be punishable under this Code;\n(b) the expression “computer resource” shall have the meaning assigned to it in clause (k) of sub-section (1) of section 2 of the Information Technology Act, 2000 (21 of 2000);]\n1[Illustration]\n2*** A, 3[who is 4[a citizen of India]], commits a murder in Uganda. He can be tried and convicted of murder in any place in 5[India] in which he may be found.\n6* * * * *",
  "chapter_id": "CHAPTER I",
  "chapter_name": "INTRODUCTION",
  "language": "en"
 },
 {
  "id": "A1860-45:5",
  "act_id": "A1860-45",
  "section_number": "Section 5.",
  "slug": "5",
  "structural_unit": "section",
  "heading": "Certain laws not to be affected by this Act.",
  "full_text": "Nothing in this Act shall affect the provisions of any Act for punishing mutiny and desertion of officers, soldiers, sailors or airmen in the service of the Government of India or the provisions of any special or local law.]",
  "chapter_id": "CHAPTER I",
  "chapter_name": "INTRODUCTION",
  "language": "en"
 },
 {
  "id": "A1860-45:302",
  "act_id": "A1860-45",
  "section_number": "Section 302.",
  "slug": "302",
  "structural_unit": "section",
  "heading": "Punishment for murder.",
  "full_text": "Whoever commits murder shall be punished with death or 1[imprisonment for life], and shall also be liable to fine.",
  "chapter_id": "CHAPTER XVI",
  "chapter_name": "OF OFFENCESAFFECTINGTHE HUMAN BODY — Of offences affecting life",
  "language": "en"
 },
 {
  "id": "A1872-1:8",
  "act_id": "A1872-1",
  "section_number": "Section 8.",
  "slug": "8",
  "structural_unit": "section",
  "heading": "Motive, preparation and previous or subsequent conduct.",